{
  "protection_logic_context_id": "PLC-E2026-04-15-001",
  "event_id": "E2026-04-15-001",
  "asset_id": "CONDENSER_TRAIN_A",
  "generated_at": "2026-04-15T15:00:00Z",
  "logic_sets": [
    {
      "logic_id": "LOGIC-TURB-TRIP-VACLO",
      "logic_type": "trip",
      "description": "Turbine trip on condenser low-low vacuum. Trip initiates when U1-PT-CND-4201 exceeds 3.50 inHgA (lower-lower setpoint). This setpoint was NOT reached during the event; condenser pressure peaked at 2.10 inHgA.",
      "setpoints": [
        {
          "parameter": "U1-PT-CND-4201",
          "comparison": ">=",
          "threshold": 3.5,
          "unit": "inHgA"
        }
      ],
      "input_signals": ["U1-PT-CND-4201"],
      "output_signals": ["U1-TURB-TRIP-SIG"],
      "document_refs": ["EOP-T.1", "SOP-COND-002"]
    },
    {
      "logic_id": "LOGIC-TURB-RUNBACK-VACLO",
      "logic_type": "actuation",
      "description": "Turbine load runback on condenser backpressure above 2.00 inHgA. Runback rate 5% per minute. Actuated at 13:26:10 during this event.",
      "setpoints": [
        {
          "parameter": "U1-PT-CND-4201",
          "comparison": ">=",
          "threshold": 2.0,
          "unit": "inHgA"
        }
      ],
      "input_signals": ["U1-PT-CND-4201"],
      "output_signals": ["U1-TURB-RUNBACK-SIG"],
      "document_refs": ["AOP-10", "SOP-COND-003"]
    }
  ],
  "barrier_states": [
    {
      "barrier_id": "BARRIER-TURB-TRIP-VACLO",
      "sf_id": "SF-TURB-INTEGRITY",
      "state": "held",
      "state_timestamp": "2026-04-15T14:05:00Z",
      "evidence_refs": ["SOE-002", "SOE-003"],
      "rationale": "Turbine trip barrier remained held throughout the event. The 3.50 inHgA lower-lower trip setpoint was not reached. Runback was actuated at 2.10 inHgA per AOP-10 and successfully halted vacuum degradation before the trip threshold."
    }
  ],
  "provenance": {
    "generated_by": "show-and-tell-fixture-generator",
    "query_params": {
      "test_case": "TC-2",
      "scenario": "condenser-vacuum-loss-pwr-u1"
    }
  }
}
